country,Name,Symbol,Sentiments,marketcap,"Stock Price (6wk ago),","Stock Price (5wk ago),","Stock Price (4wk ago),","Stock Price (3wk ago),","Stock Price (2wk ago),","Stock Price (1wk ago),","Stock Price (0wk ago),"
Japan,Honda,HMC,"['The Zacks Analyst Blog Highlights Ford, General Motors, Honda and Tesla', 'Ford, General Motors, Honda and Tesla have been included in this Analyst Blog.', ""EV Roundup: Ford (F) and Honda's (HMC) Electrification Strides Make News"", 'While Ford (F) promises seven new EVs lined up for Europe by 2024, Honda (HMC) is set to refurbish its plants in Alliston to manufacture hybrid electric cars.', ""Photos: Inside Honda's new $124 million Central Ohio wind tunnel"", 'Honda engineer Mike Unger sounds like a kid at play when he talks about the automaker’s new $124 million wind tunnel.', ""Volkswagen exec on the electric VW bus: 'I’ve never seen this much demand for a vehicle'"", ""Volkswagen Group of America President and CEO Scott Keogh joins Yahoo Finance Live to discuss the automaker's investment in North American manufacturing, the chip shortage, the electric VW bus, and what's driving the transition to electric vehicles."", ""Toyota's (TM) North American Arm to Invest $27M in California"", ""Toyota's (TM) North American division announces $27M investment in California's TABC to expand production capabilities."", 'Fed Trying to Play Catch-Up (Capital Market Research) (Weekly Market Outlook)', '', ""Honda's (HMC) to Invest $1.38B in CR-V Hybrid Model in Canada"", 'Honda (HMC) will invest $1.38 billion in its Canada plants to manufacture the next generation 2023 CR-V Hybrid model to make a mark in the EV domain.', 'Honda to spend over $1 billion to upgrade Ontario factories', ""The investment would make the facility the biggest plant in the region for the 2023 CR-V Hybrid crossover and includes equal grants of C$131.6 million from the governments of Canada and Ontario, Honda of Canada Mfg said on Wednesday.  Honda's announcement comes at a time when automakers globally have sharpened their focus on producing environmentally friendly vehicles in response to rising demand.  Prime Minister Justin Trudeau's government sees the auto sector as a key part of its efforts to lower national carbon footprint."", 'China’s Covid-19 Lockdown Is the Wrong Risk at the Wrong Time', 'The lockdown of Shenzhen, China’s tech hub, has wider global implications that are already coming into play.', ""These were Central Ohio's best-selling vehicles in 2021"", 'While pickup trucks rule sales nationally, that American vehicle of choice does not have the same hold on the Columbus market.']",51654283264,29.600000381469727,31.719999313354492,31.18000030517578,29.81999969482422,26.389999389648438,27.15999984741211,28.510000228881836
United States,Rivian,RIVN,"['Tesla is ‘one of the market’s best secular growth stories’: Analyst', ""CFRA Analyst Garrett Nelson joins Yahoo Finance to discuss Tesla's growth as it opens new gigafactories overseas, the EV manufacturer's production goals, and Tesla's position in the competitive EV space."", '10 Most Anticipated IPOs of 2022', 'In this article, we discuss 10 most anticipated IPOs of 2022. If you want to see more companies in this selection, click 5 Most Anticipated IPOs of 2022. 2021 was widely dubbed as the year of IPOs, since initial public offerings in the year fetched approximately $594 billion, a record high. SPACs, along with technology […]', 'Electric vehicles: Cadillac kicks of Lyriq production in Tennessee', ""Yahoo Finance's Pras Subramanian details productions on the Cadillac Lyriq EV beginning in the vehicle manufacturer's Tennessee plants, General Motors' summer delivery date, the production figures GM is expecting, and GM's stake in Cruise Automations."", 'Why Rivian Shares Dropped Today', 'As Elon Musk noted, manufacturing is hard. But several things are starting to make it even harder for Rivian.', '3 Top Stock Trades for the Week', 'Last week, buyers returned with a vengeance, sending the S&P 500 higher by 1% for four consecutive days. The participation groundswell created a bullish technical signal known as a “breadth thrust.” Past episodes with such a broad-based and consistent surge resulted in more gains over the coming months. Instead of being the last gasp of a dying bull, they were the first breaths of a new one. This will color my approach to future editions of the best stock trades to consider. But as rosy a pictur', ""Volkswagen exec on the electric VW bus: 'I’ve never seen this much demand for a vehicle'"", ""Volkswagen Group of America President and CEO Scott Keogh joins Yahoo Finance Live to discuss the automaker's investment in North American manufacturing, the chip shortage, the electric VW bus, and what's driving the transition to electric vehicles."", 'Climate tech opportunities ‘are increasing radically,’ venture capitalist says', 'As major climate reports sound the alarm on unprecedented challenges stemming from global warming, private markets see more opportunities to profit.', 'With Stocks Down 70% and 76%, Are Nio and Rivian Buys?', ""Despite last week's broader market rebound, many electric vehicle (EV) stocks remain down substantially from their all-time highs.  Chinese automaker Nio (NYSE: NIO) and American EV newcomer Rivian Automotive (NASDAQ: RIVN) have seen their share prices fall as much as 80% from their respective all-time highs.  Howard Smith (Nio): Nio shares have been trending down this year, but a recent tumble has brought them to the lowest level in almost two years."", 'The Case for Buying Rivian Stock', ""This may be an unpopular opinion at the moment, but I think Rivian Automotive (NASDAQ: RIVN) could be an attractive buy-and-hold stock for the long term.  The company has been absolutely crushed on the market, down 76% from its all-time high set just a few months ago, but there are some positives for Rivian's business.  Despite production challenges, Rivian does expect to ramp up to 25,000 vehicles produced in 2022."", '1 Electric Vehicle Stock to Buy Hand Over Fist and 1 to Avoid Right Now', 'Once a darling of the stock market, electric vehicle (EV) stocks have recently come under significant pressure.  With Russia as the major supplier of nickel, a critical ingredient in EV batteries, prices of this key raw material have been surging at a breakneck speed.  Several EV players focused on premium models (which use nickel-heavy, lithium-ion batteries) will either be forced to raise prices or reduce margins.']",51555225600,60.95000076293945,66.29000091552734,62.38999938964844,61.90999984741211,42.209999084472656,37.0,46.93000030517578
China,Great Wall Motors,601633.SS,No data!,46988271198,40.29999923706055,38.650001525878906,36.91999816894531,36.79999923706055,30.389999389648438,27.260000228881836,28.8799991607666
United States,Lucid Motors,LCID,"['Tesla is ‘one of the market’s best secular growth stories’: Analyst', ""CFRA Analyst Garrett Nelson joins Yahoo Finance to discuss Tesla's growth as it opens new gigafactories overseas, the EV manufacturer's production goals, and Tesla's position in the competitive EV space."", 'Nvidia teams up with Lucid and BYD for new self-driving platform', 'Nvidia is bringing its self-driving tech Lucid and BYD vehicles.', 'Lucid Announces Integration of Its Proprietary DreamDrive Pro Advanced Driver-Assistance System with NVIDIA DRIVE Hyperion Software-Defined Platform', 'Lucid Group, Inc. (NASDAQ: LCID), setting new standards with the longest-range, fastest-charging electric car on the market, announced today that its DreamDrive Pro advanced driver-assistance system (ADAS) will add new features in the future, building on NVIDIA DRIVE Hyperion technology – a powerful software-defined platform already integrated in every Lucid Air on the road today.', ""Volkswagen exec on the electric VW bus: 'I’ve never seen this much demand for a vehicle'"", ""Volkswagen Group of America President and CEO Scott Keogh joins Yahoo Finance Live to discuss the automaker's investment in North American manufacturing, the chip shortage, the electric VW bus, and what's driving the transition to electric vehicles."", 'Megatrends: CEO’s of LCID, XTMIF, BBIG, and MKTDF Focus on Next Wave of Billion Dollar Market Opportunities in Electric Vehicles, Fintech, Carbon Credit NFTs, And Digital Media', 'NEW YORK, March 21, 2022 (GLOBE NEWSWIRE) -- Wall Street Reporter, the trusted name in financial news since 1843, has published reports on the latest comments and insights from CEO’s of: Lucid Group, Inc. (NASDAQ: LCID) XTM, Inc. (OTC: XTMIF) (CSE: PAID) DeepMarkit (OTC: MKTDF) (TSX.V: MKT), and Vinco Ventures (NASDAQ: BBIG). Today’s emerging technologies and lifestyle megatrends are unleashing trillion dollar market opportunities for disruptive innovation in how we live, work and play. Wall Str', 'Climate tech opportunities ‘are increasing radically,’ venture capitalist says', 'As major climate reports sound the alarm on unprecedented challenges stemming from global warming, private markets see more opportunities to profit.', 'Behind on production, Lucid may join Tesla in hiking the price of its electric vehicles', ""CEO Peter Rawlinson said future buyers of Lucid's luxury EVs may pay more due to soaring nickel prices in the wake of Russia's invasion of Ukraine."", 'Investing in Electric Vehicles and Green Transportation', 'Increased competition, rapid changes in technology, and current government priorities suggest that the future of transportation is undoubtedly electric.', 'Trillion Dollar EV Boom: CEOs of ChargePoint, First Energy Metals, Tesla and Lucid Driving Innovation and Revenue Growth With Batteries, Charging Stations and Driving Technologies', 'NEW YORK, March 09, 2022 (GLOBE NEWSWIRE) -- Wall Street Reporter, the trusted name in financial news since 1843, has published reports on the latest comments and insights from CEOs of: ChargePoint Holdings (NYSE: CHPT), First Energy Metals (OTC: FEMFF) (CSE: FE), Lucid Group (NASDAQ: LCID) and Tesla, Inc. (NASDAQ: TSLA). The transition to electric vehicles is expected to be a multi-trillion dollar megatrend as it unfolds in the coming years. Generational investing opportunities are presenting t', 'Lucid Group Stock Holders Shouldn’t Take Lowered Guidance to Heart', 'When you see social-media traders chattering about California-based electric vehicle (EV) manufacturer Lucid Group (NASDAQ:LCID), it’s sometimes due to some really good news. Other times, however, it’s because LCID stock is dropping like a rock. Source: T. Schneider / Shutterstock Lucid’s growth story has had its ups and downs, and growing pains ought to be expected. Nevertheless, the investing community isn’t always as patient as it should be with startup EV makers. This seems to be the case wi']",44402597888,27.43000030517578,28.8700008392334,25.510000228881836,24.989999771118164,24.239999771118164,21.979999542236328,26.649999618530273
Italy,Ferrari,RACE,"['Italy set to curb use of Russian anti-virus software in public sector', ""Italy's government is poised to curb the use of Russian anti-virus software in the public sector in the wake of Russia's invasion of Ukraine, fearing Moscow could hijack the programs to hack key websites, officials said.  Franco Gabrielli, the state undersecretary for security, told the Senate on Tuesday that the government was working on rules to allow state bodies to pull the plug on software developed by the Russia-based Kaspersky Lab.  A government source told Reuters that the new rules would let public administrations replace all software deemed potentially dangerous, without facing penalties."", 'Ferrari N.v.: Periodic Report on the Buyback Program', 'Maranello (Italy), March 14, 2022 – Ferrari N.V. (NYSE/EXM: RACE) (“Ferrari” or the “Company”) informs that the Company has purchased, under the sixth tranche of the common share buyback program announced on March 3, 2022 (“Sixth Tranche”), additional common shares - reported in aggregate form, on a daily basis - on Euronext Milan (EXM) and on the New York Stock Exchange (NYSE) as follows: EXMNYSETotalTradingNumber of common shares purchasedAverage price per shareConsideration excluding feesNumb', 'Luxury carmaker Ferrari suspends production of vehicles for Russian market', 'Luxury carmaker Ferrari said on Tuesday it would suspend exports to Russia due to Moscow\'s invasion of Ukraine.  ""Given the ongoing situation Ferrari has taken the decision to suspend the production of vehicles for the Russian market until further notice,"" the Italian company said in a statement.  Ferrari adds to a number of companies, including carmakers, other manufacturers and luxury goods groups, that have taken action to limit, put on hold or exit business activities in Russia following Moscow\'s invasion of Ukraine.', 'FERRARI N.V.: COMPLETION OF THE FIFTH TRANCHE OF THE DISCLOSED MULTI-YEAR SHARE REPURCHASE PROGRAM AND ANNOUNCEMENT OF THE SIXTH TRANCHE', 'Maranello (Italy), March 3, 2022 – Ferrari N.V. (NYSE/EXM: RACE) (“Ferrari” or the “Company”) informs that the Company has purchased, under the fifth tranche of the common share buyback program announced on October 4, 2021 (“Fifth Tranche”), additional common shares - reported in aggregate form, on a daily basis - on the New York Stock Exchange (NYSE) as follows: TradingDate(dd/mm/yyyy) Stock Exchange Number of common shares purchased Average price per shareexcluding fees($) Consideration exclud', 'Ferrari Publishes Agenda for the 2022 Agm', 'Maranello (Italy), March 2, 2022 - Ferrari N.V. (NYSE/EXM: RACE) (“Ferrari”) announced today that it has published the agenda and the explanatory notes for the 2022 Annual General Meeting of Shareholders (“AGM”), which will be held virtually on April 13, 2022, beginning at 11:30 a.m. CEST. To protect the health and safety of all participants in connection with the Covid-19 outbreak, Shareholders will not be allowed to attend the AGM in person. Ferrari’s AGM notice and explanatory notes, other AG', 'Ferrari Releases Its 2021 Annual Report and Files Annual Report on Form 20-F', 'Maranello (Italy), February 25, 2022 - Ferrari N.V. (NYSE/EXM: RACE) announced today that it has published its 2021 Annual Report and filed its annual report on Form 20-F, including financial statements for the fiscal year ended December 31, 2021, with the United States Securities and Exchange Commission. Ferrari’s 2021 Annual Report and annual report on Form 20-F are available under section Investors on Ferrari’s corporate website at http://corporate.ferrari.com, where they can be viewed and do', 'DIVIDEND DISTRIBUTION PROPOSAL', 'Ferrari N.V. (NYSE/EXM: RACE) (the “Company”) announced today that its Board of Directors intends to recommend to the Company’s shareholders a dividend distribution to the holders of common shares of Euro 1.362 per common share, implying an increase of 57% compared to the prior year and corresponding to a total distribution of approximately Euro 250 million. The distribution will be subject to its approval by the Annual General Meeting of Shareholders which is scheduled to be held on April 13, 2', 'Could The Ferrari N.V. (NYSE:RACE) Ownership Structure Tell Us Something Useful?', 'A look at the shareholders of Ferrari N.V. ( NYSE:RACE ) can tell us which group is most powerful. Institutions often...', '3 Reasons Why Ferrari Is a Buy', ""Its excellent stock ticker symbol no longer represents the big picture, and that's a good thing."", 'Alfa Romeo Takes Blockchain and NFTs to a New Level', 'Car manufacturers continue to explore the Metaverse and NFTs at the turn of the year. Alfa Romeo is using NFTs to deliver a non-fungible log book.']",41415847936,227.08999633789062,224.24000549316406,216.42999267578125,208.47999572753906,181.47999572753906,195.1999969482422,212.38999938964844
China,NIO,NIO,"['Tesla is ‘one of the market’s best secular growth stories’: Analyst', ""CFRA Analyst Garrett Nelson joins Yahoo Finance to discuss Tesla's growth as it opens new gigafactories overseas, the EV manufacturer's production goals, and Tesla's position in the competitive EV space."", 'NIO Stock Could Weather the Macro Headwinds, Says Morgan Stanley', 'Recently, the Chinese EV space has been beset by several worrying developments. Morgan Stanley’s Tim Hsiao counts “geopolitical tensions, pervasive Covid curbs and ADR de-listing risks” which have further impacted EV start-ups already struggling with operational challenges such as disruptions to the supply of chips, batteries and other elements. Rising EV manufacturing costs which will result in higher prices could also mean EV sales will take a hit. However, given the “continuous innovation,” i', 'These 10 Chinese Stocks are Rebounding as Crackdown Nears End', 'In this article, we discuss the 10 Chinese stocks that are rebounding as the crackdown nears end. If you want to read about some more Chinese stocks on the upward trajectory, go directly to These 5 Chinese Stocks are Rebounding as Crackdown Nears End. Over the past few months, a regulatory crackdown against dual-listed companies […]', 'Why Are Tesla, Volkswagen And Nio Scrambling For Graphite?', 'The electric vehicle boom is well underway, and one crucial material could surge by as much as 4000% as demand continues to climb', 'Super luxury brands like Lamborghini and Bentley will be successful EVs: VW US chief', 'Here comes the age of electric for super luxury brands such as Bentley and Lamborghini.', ""Tesla's new Gigafactory is its biggest strategic endeavor in a decade: analyst"", ""Tesla's Berlin Gigafactory is ready for business."", 'Why NIO Stock Still Has Further to Soar', 'Nio (NYSE:NIO) stock has been wiped out. What’s going on there? Well, a few things are leading to this plummet. With geopolitical tensions on the rise, the threat of Chinese stocks being delisted from U.S. markets looms large. And it’s got investors rattled enough to dump those holdings, including NIO. And in tandem, nickel prices have skyrocketed — and we’ve seen some Covid-19 lockdowns in parts of China. The market is worried about how these things could affect the auto supply chain, not to me', 'Why Nio Stock Is Sinking Today', 'After a stunning rally last week, Nio (NYSE: NIO) stock opened Monday on a quiet note and was trading down 5.5% as of 10:45 a.m. ET.  An analyst downgrade just ahead of earnings is hitting investor sentiment even as Nio just confirmed it will not follow the footsteps of rival Tesla in increasing prices of its electric vehicles (EVs).  Nio is set to report its fourth-quarter and full year 2021 earnings after market close on Thursday.', 'NIO Slides Despite Positive Deutsche Bank Comments', 'By Sam Boughedda', 'Two Monster EV Stocks You Can Buy For Less Than $25', 'These two growth stocks have seen their share prices fall in recent months, but could be good long-term buys.']",38157774848,24.690000534057617,25.790000915527344,21.770000457763672,21.8700008392334,17.979999542236328,14.930000305175781,21.770000457763672
South Korea,Hyundai,HYMTF,"['Hyundai IONIQ 5 Named 2022 Hispanic Motor Press EV of the Year', 'The Hyundai IONIQ 5 has been named EV of the Year in the 2022 Hispanic Motor Press Awards. The 12th Annual awards program recognizes the best vehicles for Hispanic consumers based on styling, driving satisfaction, technology, safety, environmental impact, mechanical reliability, and value.', 'Hyundai IONIQ 5 Named UK Car of the Year 2022', 'The all-new Hyundai IONIQ 5 has added to its growing list of Car of the Year honors by being named overall UK Car of the Year 2022.', 'UPDATE 1-Iveco, Hyundai Motor to explore collaboration on vehicle tech, supply', 'Italian truck, bus and engine maker Iveco group said on Monday it had signed a preliminary deal with South Korea\'s Hyundai Motor Company to explore collaboration on shared vehicle technology, joint sourcing and mutual supply.  The two companies singed a memorandum of understanding (MoU), which marks a preliminary step in assessing potential cooperations in technology and platforms, encompassing components and systems, Iveco said in a statement.  ""The areas of possible mutual interest are electric powertrains and platforms such as fuel-cell systems, vehicle automation and connectivity for commercial vehicles,"" the company said without providing details.', 'Iveco, Hyundai Motor to explore collaboration on vehicle tech, supply', 'MILAN (Reuters) -Italian truck, bus and engine maker Iveco group said on Monday it had signed a preliminary deal with South Korea\'s Hyundai Motor Company to explore collaboration on shared vehicle technology, joint sourcing and mutual supply.  The two companies singed a memorandum of understanding (MoU), which marks a preliminary step in assessing potential cooperations in technology and platforms, encompassing components and systems, Iveco said in a statement.  ""The areas of possible mutual interest are electric powertrains and platforms such as fuel-cell systems, vehicle automation and connectivity for commercial vehicles,"" the company said without providing details.', 'UPDATE 1-Hyundai Motor says unsure when Russian plant operations will resume', ""South Korea's Hyundai Motor Co said on Friday it has not decided when to resume operations at its assembly plant in  St Petersburg, Russia, citing ongoing issues with components delivery.  Operations at the St Petersburg plant have been suspended since March 1."", 'Hyundai Motor says unsure when Russian plant operations will resume', ""South Korea's Hyundai Motor Co said on Friday it has not decided when to resume operations at its assembly plant in  St Petersburg, Russia, citing ongoing issues with components delivery.  Operations at the St Petersburg plant have been suspended since March 1."", 'Hyundai Motor Accelerates Electrification Strategy, Targeting 7% of Global EV Market by 2030', 'Hyundai Motor Company today unveiled a strategic roadmap to accelerate its electrification ambition as it pursues sustainable progress for the company.', 'Hyundai Motor America Reports Record-Breaking Retail February 2022 Sales', 'Hyundai Motor America reported total February sales of 52,424 units, an 8% increase compared with February 2021. Tucson (+37%), Palisade (+17%) and Venue (+16%) established new February total sales records. Hyundai did not have any fleet sales for the second month in a row.', 'Jeep to launch two new SUVs in India to boost sales', 'Stellantis\' Jeep will launch two new sport-utility vehicles (SUVs) in India this year to boost sales in a market where it has struggled to establish a meaningful presence.  Jeep will launch the Meridian, a mid-size, three-row SUV, that will be made in India, and the Grand Cherokee, which it will assemble in the country - a move the company expects will allow it to price its vehicles more competitively.  ""We need to grow in India, we need to put all the focus in India,"" Christian Meunier, chief executive at Jeep, told reporters in Mumbai.', 'Motional, Via to start robo-taxi service in Las Vegas', 'Autonomous vehicle venture Motional and ride services company Via said they will launch on Thursday a robo-taxi service in Las Vegas, the latest step by Motional toward commercial deployment of its autonomous vehicle systems.  Via will use vehicles outfitted with Motional autonomous driving systems to offer free rides between several locations in downtown Las Vegas.']",35301515264,38.40999984741211,39.650001525878906,38.97999954223633,36.15999984741211,36.18000030517578,34.0,34.66999816894531
China,SAIC Motor,600104.SS,No data!,35013982320,19.100000381469727,18.799999237060547,18.459999084472656,18.399999618530273,17.780000686645508,16.979999542236328,17.309999465942383
India,Maruti Suzuki India,MARUTI.NS,No data!,34667047519,8599.4501953125,8622.7001953125,8622.7998046875,error,6806.2998046875,7420.10009765625,7766.64990234375
